{
  "ticker": "GOOGL",
  "as_of": "2026-09-05",
  "label": "WATCH",
  "hard_veto_status": "INVESTIGATE",
  "position_band": "NONE",
  "rationale": "Search·Cloud·AI의 복수 이익원은 유지된다. 기존 Bull은 Base보다 할인율을 낮추고 영구성장률을 높여 비대칭을 증폭했다. 상방의 상당 부분이 자본비용 가정에서 생기므로 비대칭 점수를 6→5로 낮춘다. TTM Capex 약 1,324.02억 달러 이후 FCF는 약 532.73억 달러다. 투자자산 평가이익, 우선주 전환과 자금조달을 영업 현금창출·희석과 구분해야 한다. 재평가 69/100. 점수는 매수 승인이 아니며 가치평가/조사 한계는 최신 재심사 파일에 명시했다.",
  "increase_evidence": [
    "미국 9% 허들을 기준으로 동일 자본비용 민감도를 제시하고 검색 단위수익, AI 이용률과 Capex 이후 FCF/주로 투자회수를 입증한다.",
    "사업 악화 없이 검증된 주당 가치 대비 안전마진 확보"
  ],
  "reduce_or_exit_evidence": [
    "생성형 인터페이스 전환으로 검색의 수익화가 구조적으로 약해지고 높은 AI 설비투자에도 FCF/주가 회복되지 않는다.",
    "중대한 경영진·회계 신뢰 훼손"
  ],
  "macro_pacing": "company_specific",
  "confidence": 0.69
}
