{
  "ticker": "NET",
  "as_of": "2026-09-05",
  "label": "REJECT",
  "hard_veto_status": "INVESTIGATE",
  "position_band": "NONE",
  "rationale": "현재 분석가의 Bull 가치가 가격보다 낮다는 사실만으로 모든 현실적 Bull을 배제한 것은 아니다. 가격 Hard Veto는 FAIL→INVESTIGATE로 수정한다. 다만 높은 기대·희석과 58점의 낮은 투자매력 때문에 최종 REJECT는 유지한다. 기준가 281.44달러, TTM 매출 약 25.12억 달러와 SBC 약 5.08억 달러. 보고 FCF 약 3.15억 달러보다 SBC가 크다. 높은 매출 성장만으로 주당 경제가치 성장이 확인되지는 않는다. 재평가 58/100. 점수는 매수 승인이 아니며 가치평가/조사 한계는 최신 재심사 파일에 명시했다.",
  "increase_evidence": [
    "총마진·고객 유지와 SBC 이후 FCF/주 개선, 완전희석 주식수를 포함한 현실적 성장 범위 및 지배구조를 확인한다.",
    "사업 악화 없이 검증된 주당 가치 대비 안전마진 확보"
  ],
  "reduce_or_exit_evidence": [
    "고객 유지와 총마진이 구조적으로 악화하고 순희석이 높은 상태에서 FCF/주 성장도 사라진다.",
    "중대한 경영진·회계 신뢰 훼손"
  ],
  "macro_pacing": "company_specific",
  "confidence": 0.7
}
