{
  "ticker": "DDOG",
  "as_of": "2026-09-05",
  "label": "WATCH",
  "hard_veto_status": "INVESTIGATE",
  "position_band": "NONE",
  "rationale": "관측·보안 플랫폼의 성장과 충분한 현금은 인정한다. 다만 TTM SBC가 보고 FCF의 약 79%이므로 보고 FCF 마진을 그대로 높은 재투자 품질로 해석했던 점수를 10→8로 조정한다. TTM SBC 약 8.51억 달러, 연간 기본주식수 증가 약 2.97%. 보고 FCF-보상비용 프록시는 약 2.22억 달러다. 이 차액은 정확한 경제적 SBC 공정가치 측정이 아니라 민감도 지표다. 재평가 68/100. 점수는 매수 승인이 아니며 가치평가/조사 한계는 최신 재심사 파일에 명시했다.",
  "increase_evidence": [
    "큰 AI 고객의 최적화 영향을 분리한 성장, 총발행·환매 주식수와 주당 owner-FCF를 4개 분기 추적한다.",
    "사업 악화 없이 검증된 주당 가치 대비 안전마진 확보"
  ],
  "reduce_or_exit_evidence": [
    "대형고객 최적화 이후에도 매출 성장·다중제품 채택이 지속 둔화하고 SBC 이후 FCF/주가 2년 정체한다.",
    "중대한 경영진·회계 신뢰 훼손"
  ],
  "macro_pacing": "company_specific",
  "confidence": 0.7
}
